{
  "root": {
    "assetId": "DE-AS349221",
    "assetDescription": "Mercedes Bus X345",
    "assetStatus": "Active",
    "location": {
      "locationId": "L2378462378",
      "geometry": {
        "type": "Point",
        "coordinates": [ 34.23, -57.56 ]
      }
    },
    "secondaryAttributes": [
      {
        "name": "modeItemId",
        "value": "10001",
        "category": "BUS",
        "dataType": "string"
      }
    ]
  },
  "subassets": [
    {
      "assetId": "DE-E9438758576549",
      "assetDescription": "Mercedes Bus Engine",
      "assetStatus": "Active",
      "fuelType": "Diesel",
      "secondaryAttributes": [
        {
          "name": "enginesize",
          "value": "6L",
          "category": "BUS",
          "dataType": "string"
        }
      ]
    }
  ],
  "subcomponents": [
    {
      "componentId": "DE-TYRE32876578423",
      "componentDescription": "Bus Tyre",
      "parentAssetId": "AS349221",
      "tyreSize": 48,
      "tyrePosition": "Back Left",
      "secondaryAttributes": [
        {
          "name": "manufacturer",
          "value": "Kumho",
          "category": "TYRES",
          "dataType": "string"
        }
      ],
      "assets": []
    },
    {
      "componentId": "DE-TYRE5687966798",
      "componentDescription": "Bus Tyre",
      "parentAssetId": "AS349221",
      "tyreSize": 48,
      "tyrePosition": "Back Right",
      "secondaryAttributes": [
        {
          "name": "manufacturer",
          "value": "Kumho",
          "category": "TYRES",
          "dataType": "string"
        }
      ],
      "assets": []
    },
    {
      "componentId": "DE-TYRE43095394067",
      "componentDescription": "Bus Tyre",
      "parentAssetId": "AS349221",
      "tyreSize": 43,
      "tyrePosition": "Front Left",
      "secondaryAttributes": [
        {
          "name": "manufacturer",
          "value": "Kumho",
          "category": "TYRES",
          "dataType": "string"
        }
      ],
      "assets": []
    },
    {
      "componentId": "DE-TYRE2385734687394",
      "componentDescription": "Bus Tyre",
      "parentAssetId": "AS349221",
      "tyreSize": 43,
      "tyrePosition": "Front Right",
      "secondaryAttributes": [
        {
          "name": "manufacturer",
          "value": "Kumho",
          "category": "TYRES",
          "dataType": "string"
        }
      ],
      "assets": []
    }
  ],
  "features": [
    {
      "featureId": "DE-myFeature123",
      "featureDescription": "Generic Feature",
      "parentAssetId": "myasset123",
      "secondaryAttributes": [
        {
          "name": "colour",
          "value": "Pink",
          "category": "Appearance",
          "dataType": "string"
        }
      ],
      "assets": []
    }
  ]
}
